title,description,payout,limit,link,targetGeo,requiredTier
Step 1: Join InboxDollars (US),Sign up using a valid email address and complete all required steps. You must confirm your email to qualify. Incomplete or invalid submissions will not be rewarded.,0.55,15,https://afflat3d3.com/trk/lnk/0C3A139E-9517-46F7-825B-A826E3E5BA17/?o=6365&c=918277&a=762196&k=9838B6D2A0321F5B49ACF0C15C4AD4CC&l=5077&s1={user_id}&s2=inboxdollars&s3=pilot_t1_us_01&s4={attempt_id},US,New
Quick InboxDollars Signup (US),Use a valid email address and complete the signup carefully. Email confirmation is required to qualify.,0.6,15,https://afflat3d3.com/trk/lnk/0C3A139E-9517-46F7-825B-A826E3E5BA17/?o=6365&c=918277&a=762196&k=9838B6D2A0321F5B49ACF0C15C4AD4CC&l=5077&s1={user_id}&s2=inboxdollars_b&s3=pilot_t1_us_02&s4={attempt_id},US,New
Earn Rewards Signup (AU),Register using accurate details and complete all required steps. You must confirm your email to qualify. Only Australian users should attempt this task.,1.25,20,https://afflat3d2.com/trk/lnk/0C3A139E-9517-46F7-825B-A826E3E5BA17/?o=22888&c=918277&a=762196&k=3E3C714EE455484B4D586EE0AD4AD85D&l=23809&s1={user_id}&s2=rewardia&s3=pilot_t2_au_01&s4={attempt_id},AU,New
Reward Platform Registration (AU),Complete the registration using real details and confirm your email to qualify. Incomplete submissions will not be rewarded.,1.35,20,https://afflat3d2.com/trk/lnk/0C3A139E-9517-46F7-825B-A826E3E5BA17/?o=22888&c=918277&a=762196&k=3E3C714EE455484B4D586EE0AD4AD85D&l=23809&s1={user_id}&s2=rewardia_b&s3=pilot_t2_au_02&s4={attempt_id},AU,New
Survey App Signup (US/CA iOS),Complete the signup on an iPhone or iPad and follow all required steps. This task is for eligible iOS users only.,1.8,8,https://afflat3d2.com/trk/lnk/0C3A139E-9517-46F7-825B-A826E3E5BA17/?o=30409&c=918277&a=762196&k=598139E3053E05D523B64B71A673531A&l=34952&s1={user_id}&s2=survey_club_ios&s3=pilot_t3_ios_01&s4={attempt_id},"US, CA",New
iOS Research App Registration (US/CA),Install or open the iOS app and complete all required steps. Only iPhone and iPad users should attempt this task.,1.95,8,https://afflat3d2.com/trk/lnk/0C3A139E-9517-46F7-825B-A826E3E5BA17/?o=30409&c=918277&a=762196&k=598139E3053E05D523B64B71A673531A&l=34952&s1={user_id}&s2=survey_club_ios_b&s3=pilot_t3_ios_02&s4={attempt_id},"US, CA",New
